free_text,label_id
"Yet every year a snow boarder or skier see the untouched snow and ca n't resist and ends up going over a 1,000 foot cliff to his death .",0
I was n't able to attend the last event but really would like to met some normal people in San Diego .,0
Does anyone want to meet somewhere within the next few weeks ?,0
Maybe spread some HATE and intolerance ?,1
"I had another picture on here at one point , with my old account , but it must be in the old thread .",0
I used to enter horse competitions until I was thrown off one and broke my leg .,0
Now I will not go near them .,0
There is more to race than just skin color .,0
"I guess us whites who tan for most of the year stop being whites save for a few winter days , eh ?",0
"I like the Japanese , i really do .",0
I have nothing against them .,0
I respect them .,0
Hey there I 'm just up the mountain from u .,0
In BB .,0
If u wanna chat drop me a line RaHoWa !,0
open a new shop somewhere get my son more interested in education ( he hates school ) help mor ein my community try to whiten things up > >,1
sorry sisters and brothers but she lie to you she was not what she said she was fake used me and a other brother the same time so watch her ? say safe goldeboy 88,0
Hang in their it will happen. seems it takes some woman years to figure out they dont like being treated bad. keep being nice but not a pushover .,0
"Hey j.p. i called the number you left me in my mail a couple of weeks ago but they said they never heard of ya , i e-mailed you back and havent heard back , shoot me yopur #again .",0
"I live on Long Island , need to get a new drivers license , but when I do , Im up for travelling .",0
Draco,0
well since we have all of us from phoenix lets exchange numbers and meet up dont laugh at the email addy it was a joke hehe pure _ tattooed _ white _ trash@yahoo.com,0
Where did you go to school in Oregon ?,0
I grew up there but just moved to Santa Barbara for grad school .,0
"Cheers , Edward",0
Are there any ple`s started yet then ? and if so where are they so we can check them out maybe we will move to one .,0
This flier addresses three of the goals that I work hard to accomplish .,0
1 .,0
"Living in a boarder state , Texas , the problems of illegal aliens is , naturally , a stark reality , and let me add that the only solution that I see is the implimentation of U.S. Troops as guards on the Mexican boarder .",1
2 .,0
Supporting our men and women in the armed forces .,0
"In another thread , I was railed by several respectable members of StormFront for my unconditional support of our troops .",0
"This flier makes it easier for everyone to get behind our troops , by moving them out of Iraq , and to a location where they will be performing according to the U.S. Constitution .",0
`` Defend our Boarders . '' 3 .,0
"Educating the Lemmings in reguard to the Isreali agenda , which is fighting a war for the Jew 's benifit not America 's .",0
"This coming week , I will be sliding hundreds of these fliers under the windshield wipers of cars in the mall parking lots in the Houston area .",0
I urge all White Nationalist in this area to do the same .,0
"If you plan to work a particular mall in the Houston area , please PM me , so we can coordinate , and cover more area .",0
"Gee , I may finally make the news for doing something other than being an ugly Harley Rider in a `` No Ugly Zone . ''",0
MrBadgerSir,0
This looks really good Peachy .,0
"And if we had just a few hundred more people on this data base thread , we would have those open PLEs by now .",0
This is from the back-file at Stormfront 's Advanced Scout forum which is solely devoted to promoting the Pioneer Litte Europe strategy .,0
I dont doubt what your saying about the BNP and i hope they do well .,0
As i say iam active in another party and their meeting was where i live so i thought i would turn up .,0
I even thought of showing up to their paper sell outside of Heathway train station on the following saturday,0
Thanks for the posting and all they contains .,0
C Cheers to all my WHITE BROTHERS AND SISTERS .,0
[ COLOR = `` Red '' ] FOREVER WHITE AND PROUD TON,0
Thank you for this update .,0
And anyone who reads it is asked to bump it into view ( by simply commenting ) for the many others who need know .,0
Your idea sounds like the perfect plan for creating WN crack houses and a bunch of lay around druggies and drunks .,0
Bless you Mr. Duke !,0
Your videos are excellent and you 're one of the most enlightened Whites in our struggle .,0
I wish you every success .,0
"Great thread and welcome to the South.So glad you left that crumbling state of California.North Ga , Tenn. , and N. Alabama are wonderful places to be among our own people .",0
"According to the poll there 's still a resistant bunch that 's still got the confusion of the devil in' em , but we 'll keep working until they turn around .",0
Check out ghost towns .,0
Some of us are buying up houses and lots in a small town in ND and we own a decent percentage of it .,0
Will be able to elect our own mayor soon .,0
It is a lovely town too .,0
"Lots run about $ 500 , houses about $ 3000 .",0
We should have a giant celebration with a large number of White Nationalists present and let the world know we do not appreciate Nelson Mandela and his long history of being anti-White .,0
Wasn't meaning yo be hard on you or Knightrider1961 .,0
Some Klansmen refuse to see where real problems are .,0
At times it is perplexing .,0
"Well said Ghost but , dont bother with that dude-he is one of those that always has to have the last word so it will just go on and on .",0
The next world cup will be the greatest murder and rape fest since Katrina .,1
Imagine the groids licking their big lips when they see all those unsuspecting tourists walking around .,1
The only species that constantly grabs his crotch in front of others and waves their arms around furiously are : 1. monkeys 2. blacks 3. both of the above Need I say more ?,1
I sent out a few more emails the other day and then last night handed out about 25 or so leaflets made up of David Duke 's talk on this and the Duke Lacrosse case that the St. Louis Volksfront donated me .,0
When i first joined up i was shocked at how ( no offence ) elderly some of the people who post here are .,0
"I was on web site not long ago checking into buying land in eastern europe while its still cheap , and not in the hands of other races. it looks like a good investment. and more importantly one way of keeping europe white helping to prevent our extintion .",0
Spread the link everywhere in public and in internet !,0
"Here ´ s some ideas for you , https : //www.stormfront.org/forum/show ... = 298321 & page = 3",0
Last Friday an associate here handed out 100 NV leaflets at a rodeo depicting a graphic summation of non-white ( mestizo ) immigration .,1
"Well...here's what we 're up to : YANKEE _ JIM $ 100.00 Octavian $ 20.00 bigguy $ 20.00 Flax $ 300.00 Umberto $ 25.00 Cabal _ 88 $ 10.00 Gauleiter $ 20.00 Florida88 $ 10.00 -------- Total so far = $ 505.00 ADDED 9/30 Awake777 $ 20.00 JD ( Hyde Park , NY ) $ 10.00 Iconoclast14 $ 32.00 R-I-Z-Z-O ( Whitelion ) $ 30.00 DRC ( Florida ) $ 25.00 DH ( Maryland ) $ 25.00 Lawdog $ 25.00 Bamaman $ 10.00 Scipio Americanus $ 10.00 ------------------ $ 187.00 New total = $ 692.00 ADDED 10/01 Yankee Jim $ 25.00 ------------------------ New total = $ 717.00 ADDED 10/11 VM ( NA TN member ) $ 10.00 DH ( NA Maryland member ) ANOTHER $ 20.00 !",0
"New total = $ 747.00 vonFreyja88 sent $ 60.00 which I 've not received yet , ( hopefully in PO Box in AM ) and the NA member from the Poughkeepsie , NY area who does not post here pledged another $ 50.00 , which I do n't have in my hand yet , brings the total to : $ 857.00 !!!",0
Now ... IF someone wants to make a donation at the absolute last minute ... please see my above quote .,0
My wife is in the other room now getting her totals together to hand in tomorrow morning .,0
THANKS AGAIN !,0
-Yankee Jim,0
I go into town and put resistance.com buisness cards in public libraries and give them out on the street to various people that have a white complexion .,0
I just moved here and all my old friends moved away .,0
I have been able to become more active than ever because of this site .,0
Thank you skingirl,0
Suspect also linked to 2009 murder rape case ..,0
"These feral negroes stalk white women , rape and kill and , no one seems willing to stop them .",1
"The media is reluctantly covering this , surely not with the same intensity as when the criminal Brown was killed in Ferguson .",0
Seems like black criminals get more sympathy from the msm than innocent white women .,0
"Shocking and outrageous , that is what we all should be feeling. jmho b.e.",0
Police : Suspect in U.Va. case linked to 2009 homicide Virginia State Police said Monday that a suspect charged in the disappearance of a University of Virginia sophomore is linked through forensic evidence to the abduction and murder of another college student five years ago .,0
"Jesse Matthew Jr. , 32 , was arrested near Galveston , Texas , last week and charged with abduction with intent to defile in connection with the disappearance of Hannah Graham , 18 , who is still missing .",0
"Police confirmed Monday that forensic evidence links Matthew , a University of Virginia Hospital worker , to the disappearance and slaying of 20-year-old Morgan Harrington in October 2009 .",0
He suspected of taking a crap high atop the empire state building a few years ago right out in the open with people walking around ..,0
Rapper Kanye West caught pooping at the empire state building .,0
- Topix,0
...is rotten to the core .,0
"Only in the mind of the INTERNATIONAL JEW could such an evil machination , with its ticker tape parade of lies , be cooked up !",1
"if its such a big deal that you need to talk about it , yes. you are a non-white. you might as well be fully mongol .",1
STDs have nothing to do with the morality and the genetics .,0
Stop justifying your yellow fever .,0
White + Asian DOES NOT make white babies .,1
"As I said when the races are mixed its more difficult but they can between a white , black or Asian and that proves that races exist .",0
It contradicts his statement that races dont exist .,0
I would n't be surprised if I 've yelled and cussed at one of his call center cousins on the phone before .,0
"Miami,( I do n't know how Don can stand living down there ) Hispanic - 279,456 ( 70.0 % ) Black alone - 64,993 ( 16.3 % ) White alone - 47,622 ( 11.9 % ) Asian alone - 3,649 ( 0.9 % ) Two or more races - 2,642 ( 0.7 % ) Other race alone - 676 ( 0.2 % ) American Indian alone - 361 ( 0.09 % ) Native Hawaiian and Other Pacific Islander alone - 58 ( 0.01 % ) Read more : Miami , Florida ( FL ) profile : population , maps , real estate , averages , homes , statistics , relocation , travel , jobs , hospitals , schools , crime , moving , houses , news , sex offenders",1
"Camden New Jersey demographics : Hispanic - 36,379 ( 47.0 % ) Black alone - 34,277 ( 44.3 % ) White alone - 3,792 ( 4.9 % ) Asian alone - 1,599 ( 2.1 % ) Two or more races - 938 ( 1.2 % ) American Indian alone - 235 ( 0.3 % ) Other race alone - 109 ( 0.1 % ) Native Hawaiian and Other Pacific Islander alone - 15 ( 0.02 % )",0
I take it as a compliment when someone calls me a Nazi because they are essentially comparing me to the greatest men to have ever walked this planet .,0
I do n't like how you say far greater than your own white blood relatives but there is nothing wrong in being polite to them of course .,0
Thanks for putting this up .,0
I cannot imagine how revolting it must be - the PC dialogue at your university -- idolizing athletes who dont belong in college -- white women getting pregnant with freaks,0
It's going to be a great read whenever all the chapters are translated !,0
Dr.,0
Duke has mentioned this book several times .,0
"I was born in Canada but my family is 730 + members strong and we are all from Ireland , so the heritage is thick and the pride is strong .",0
White kids need to interact with kneegrows and other non white kids or they 'll be lost in the real come the time they leave home ...,1
"As a nation , we are in desperate need for an immigration time out and a zero tolerance policy for those here illegally .",1
"Hi, I 'm trying to move myself and my three year old son up to Northern California or even out of state somewhere near woodlands and I am curious if anyone knows about places I might be able to stay for cheap or free or if anyone has a contact .",0
Please help,0
The reason liberals become teachers and social workers is because other occupations are not as accepting towards people who live in the fantasy world of political correctness and non-factual thinking .,0
"`` Those who ca n't do , teach '' - my dad .",0
"Just wanted to give this another bump and call out to anymore people in the Calgary area that are interested in meeting up , please feel free to message me .",0
I will be reading this while away for Christmas .,0
A Government of Wolves : The Emerging American Police State A Government of Wolves : The Emerging American Police State,0
Blacks acting uncivilized ?,3
"That 's about the same as saying the sky is blue , or the grass is green .",0
It 's just the way they are .,1
TNB !,3
Thanks to all the people that have come out to meet up recently it has been a real pleasure to meet everyone .,0
It was great to see some new faces come out to one of our recent events and we are looking forward to seeing everyone that has been consistently coming to our weekly meets and those who are going to be coming out for the first time .,0
I would like to continue to encourage new people to come out and to message me if you are interested in coming out to our social gatherings and meets. it is always nice to see things growing,0
And anyone wonders why white students avoid UC Berkeley ?,0
White people - report immediately to Californian University for `` re-education '' .,0
- White GeNOcide Project,1
You find they are worse since they will able to blend more and fool people into thinking they 're genuine .,1
This is a picture of Christian Albanian people they do n't look White they look like something from the Caucasus I know my Dad dated a Christian Albanian at one point she was light Brown ( I do n't just mean a tan she was literally light Brown ) she had coal black hair and a massive nose .,0
"People have the same racial origin , regardless of religion",0
Because there were already two other threads on it .,0
You can click `` New Posts '' on the red bar before you wanna create a new thread to see if the news was already posted or not .,0
Don't you ever find it strange that Al Qaeda seems to move to where Washington wants it 's troops ?,0
"Oh look , Al Qaeda is now over there .",0
"I do not blame you , Ottawa like all of our cities is a multicultural hell .",1
The race traitors sicken me too .,1
"It's not my responsibility to locate , isolate or else eliminate trolls at this site , nor do I wish to defend this person in any way .",0
"However , Loki is a trickster god within Norse mythology .",0
"In concerns of ' chaos ' , within Greek mythology Chaos was held to be the primal space between heaven and earth , being mother to all substances arising from air .",0
"As for Satan , the word comes from a root word meaning ' adversary ' and as such it should not be taken as to imply a singular being but rather anyone of an adverse nature , in a word , an opponent .",0
"In consideration of the word ' satan ' , within such a context the notion of satan worship ( to worship ones adversary ) is an altogether stupid thought .",0
"Then again , in this modern age of white youth emulating negroes and white adults groveling at the feet of the juden , perhaps it 's an appropriate word after all .",1
I've got two knife blocks on the counter .,0
One has a pretty nice mid-level quality knife set I got from an old employer in 2005 iirc and the other is loaded with a full set of the Old Hickory knives .,0
I like them .,0
I sat up with my eldest son till 5 am to watch a fight that went 14 secs .,0
I would do it again .,0
I have no doubt Los Angeles is a cess pool .,1
If you thought Canada was mostly whites you must have avoided cities .,0
Hearing the Wagner at the end of that video made me want to charge of into the night with a sword .,0
"Remember to not make it just about being anti-everyone else , but to also make it about them being proud of their own family heritage .",0
"Don't bother with black culture , it 's not worth the effort .",1
Just occasionally drive through the local hood and toss out a few new Shoes and fake toy guns and they 'll do the rest .,0
"This link covers Citrus County and you are right , some very cheap lots and , the county , looks to be our kind of placehttp://www.homosassausa.com/",0
This has been going on since the sports bring in so much money .,0
These negro sports are supported with White peoples money .,0
All the Whites I know watch negro sports and wear their sports gear .,0
On week ends the avreage White person is glued to the TV watching negros play sports .,0
I bookmarked their website last night .,0
Once the budget tightening is over for the holidays will start buying certain things from there .,0
I went to Miss state and only saw 2 jews and they were students .,0
Maybe you should look there or just move here to miss. Or more specifically Tupelo .,0
"All we have is blacks and a few mestizos and all are pretty well behaved , we keep them that way around here",1
When I am around young people and rap music or negro culture comes up I make gestures implying the savagery of blacks .,1
Gotta represent my coconuts and mangos yo !!,1
Since you 're now in college I 'd suggest working on a B.A.E. degree and plan on moving to KS and working in this new school .,0
We have to start somewhere with more than talk .,0
"I've always like this topic and found that if not in a classroom I could enjoy a teacher talking on the topic from a video camera session with maybe someone doing Powerpoint edits , hint , hint .",0
I guess this could be added to the classes available section soon at the website ?,0
Next to the section of those job openings ?,0
"They mutilate their own , and they do their best to see to it that those whom they see as their goyim slaves are also marked ....",1
"Not free , but great for programming , business , and design learning , Lynda.com.",0
"It 's a monthly fee for all you can learn , 1900 courses .",0
It offers certificates of completion for many courses .,0
Their brains have never developed so they think there still in the wild jungles of Africa .,1
Having worked around blacks at my previous job every stereotype you hear are all true .,1
The only thing that they care about is welfare and mooching of all the rest of us .,1
gander mountain told me there is no money in it surely there is some where what a great trade it would be,0
Great show !,0
My son and I have followed it since it started .,0
That is one hell of a system they designed to flood the shaft .,0
"Austrians and Dutch people are darker than the British , many of them with dark hair and brown eyes .",0
You are thinking there 's something else in their European blood but it 's only genetic variation .,0
"I needed to be in 3 places last night , including this one : Christmas with the Gothard Sisters 2014 : Show Teaser - YouTube",0
"Well, I finished Electrical Engineering at Texas Tech , and came away with four job offers.and wound up with enough money to buy houses and cars and keep my wife happy .",0
"the think different video is excellent. when i watch videos like this i get a warm nostalgic feeling inside , must be similar to my mum when she watches gone with the wind or doctor zhivago",0
"He just got completely knocked out , should be fine , I 've seen people flop around like a fish many times after being completely knocked out .",0
Could definitely do without the chest compressions .,0
"Seems to me that aluminum is lighter , softer , more prone to distortion , and creates more friction , as well as corroding more easily .",0
But I never liked working with metal as much as wood .,0
I would expect more minute particles of aluminum to be left behind in your firearm in comparison to brass .,0
I ca n't imagine anyone who loves their firearm would run very much steel through it .,0
Steel casing have to be harder on the gun .,0
Steel is harder than brass .,0
"Now , if you have an old beater to play with ....",0
A guy could shoot anything in that $ 140 Leinad 410 double barrel .,0
Load the shells with pieces of steel rod .,0
Saw that youtube video of those guys shooting 444 marlin and 454 Casull in an old 410 shotgun .,0
The old shotgun held together !,0
"My point is , that if you have a nice gun that you value , shoot good ammo in it .",0
"Do n't pay much attention to me , though .",0
I have n't had any first hand knowledge of guns for nearly two decades .,0
The border war moves closer to home : Just another day. . . . : A relaxing evening at home suddenly turns into the pursuit of drug smugglers in my neighborhood My blog. . .,0
Just another day. . . .,0
"Ya, and they kind of missed the fact that he is going to inner city schools teaching the monkeys how to better kick your white butt !",1
"Only 6 Corporations Control Over 90 % of the Television Channels These Corporations are Anti-White and are Turning Our People Into Zombies Let 's break the monopoly of news and information by supporting alternative , pro-white media like Stormfront .",0
Please click on the banner below to join Stormfront today .,0
We thank you for your support !,0
Agreed.,0
"Holy cow , I cannot believe the BS that goes on in a public school system vs. actual learning .",0
Not to mention the political correctness spew thrown into the ' actual learning ' .,0
I thought I 'd add some of my babies to the thread The iguana is a recent rescue from someone who could n't care for her .,0
I 'm very worried she is n't well .,0
"The lovely previous owner had fed her a steady diet of iceberg lettuce , carrots , and bananas , as well as 0 UVB for the past 7 months .",0
"I 'm guessing her age to be around 12-18 months , and she is TINY She 's 15 inches STL , keeping in mind she 's missing a small piece at the end .",0
"Our herp vet is gone til the middle of April , I ca n't wait to get her in and have her checked out .",0
"She 's such a sweet little thing , her temperament has changed so from when I first brought her home just 2 weeks ago .",0
All she needed was some attention and patience .,0
"And .... I know the rose hair is n't a reptile , but she 's sweet and I could n't leave her out They are another misunderstood family of creatures .",0
I think there are some great Country and Western songs about or related to driving trucks .,0
Roll On Big Mamma - YouTube,0
My gut tells me the percentage of legal minority gun owners is pretty small .,0
"Any regulation will hurt us , not them .",0
"If you want to see what having a black , kenyan White-hating muslime in the Whitehouse has created , go look at Tarantino 's latest flick Django Unchained .",1
It 's like `` The Legend Of / Vigger Charlie '' on crack .,0
Go see you tube video about Z-Backscatter Vans too .,0
yeah it just jews stealing stuff from other martial arts. dont worry about it unless they try to recruit you for the mossad,1
"You use your handgun , to fight back to your shotgun !",0
"I 've seen shots with a .45 , where people walked around angry .",0
Fedor going down like he did hurt a lot too .,0
I feel like athletic whites do not have enough kids because when you have a lot of brothers it forces you to fight your way to the top .,0
"Kurt Angle youngest of 5 brothers , Brock Lesnar youngest of 3 brother .",0
"Instead it is the athletic negro Holyfield 11 kids , Mike Tyson 7 kids , Riddick Bowe 5 kids , George Foreman 10 kids who procreate like apes and spread these athlete genes along .",1
Through numbers alone 200 million whites in this country some of these white kids should be doing wrestling and getting into MMA through wrestling .,0
Instead I am seeing this tiny percentage of black wrestlers taking all the MMA spots .,0
That's a shame I bought their home school publication years back .,0
I am looking for WN specific Home School material ?,0
Is there anything out there ?,0
My grandmother Has Red Hair .,0
My Father Had Red hair .,0
But I was Born With blond hair and it turned Brown by the time I turned 9 .,0
Everyone in my family seems to either have Green eyes or Blue too .,0
Knock Out With Knife Hands ( US Marines ) - YouTube Kelly mccan/jum grover uses lots of strikes to that area when teaching combatives,0
Remind them that they 're just another Jew tool and that they are basically spitting on the graves of millions of people that were murdered by real Communists .,1
Communism is no laughing matter and should n't be impersonated for intentional ' rebelliousness ' .,0
http://www.youtube.com/watch ? v = vaEZZnW _ MJo,0
This is exactly what the Truth Movement needs more of !,0
A couple of White woman who speak the full truth and NAME THE JEW !,0
Great job Dr. Lorraine Day and Deanna Spingola !,0
"Deanna Spingola and Dr. Lorraine Day - Zionism , the Holocaust , Aids and Vaccines YouTube - Deanna Spingola and Dr. Lorraine Day - Zionism , the Holocaust , Aids and Vaccines Listen/watch the full interview @ Deanna Spingola and Dr. Lorraine Day - Zionism , the Holocaust , Aids and Vaccines : Free Download & Streaming : Internet Archive www.DrDay.com www.GoodNewsAboutGod.com",1
"When I go to just about any Australian city I feel like a foreigner , these cities were built by my own flesh and blood , I should not feel like an alien in them .",0
"You may be right , I do n't remember if I was using a liberal curve or not when giving him a 3.5",0
