free_text,label_id
I think there might be one or two groups if they are still active I have no idea Maybe check the Daily Stormer Book Clubs ?,0
Ive never done it but heard its a great way to meet people ... although Anglin is n't my favoriate `` white nationalist '' ...,0
"How many white lives would it have saved so far if we had no non whites here , just in the USA and Canada ?",0
Why yes you should !,0
Have you seen the price of beef ?!?!,0
If you will stop eating it then it will not cost me so much .,0
Y' all have a nice day .,0
"As of December 31st , 2013 at about 8 AM PST , the booklet had been downloaded 16,270 times and counting .",0
"In order to help increase the booklets downloads , it would be great if all Stormfronters who had YouTube accounts , could display the following text in the description boxes of their uploaded YouTube videos .",0
Click below for a FREE download of a colorfully illustrated 132 page e-book on the Zionist-engineered INTENTIONAL destruction of Western civilization .,1
Click on the `` DOWNLOAD ( 7.39 MB ) '' link .,0
"Booklet updated on Dec. 9th , 2013 .",0
"( Now over 16,000 Downloads ! )",0
PDF file : http://www.mediafire.com/download/4w18ocon384cx6c/WN-Debate-Booklet+12-09-13.pdfMSWordfile:http://www.mediafire.com/download/7ic1n7oq7jidz22/WN-Debate-Booklet + 12-09-13.docx Watch the 10 hour video version of `` The Zionist Attack on Western Civilization '' @ http://trutube.tv/video/14247/The-Zionist-Attack-on-Western-Civilization-Pages-1-33-Part-1-of-4-Banned-from-YouTubeNotepadPromotionalYouTubeComment:http://www.mediafire.com/download/96fg6ft02lyfruz/Booklet _ White _ YT _ Comment _ ( Hyperlinked ) .txt http://www.mediafire.com/download/zcn3wozjbwnezms/Booklet-White-YT-Comment- ( Hyperlinked-Back-Up % 5D.txt http://www.mediafire.com/view/9uyudq1yuxu1dur/Booklet+Comment+%28Firefox%29.txtOriginal2minutepromotionalBOOKLETvideo@http://www.youtube.com/watch ? v = n663eVTSyS8 Are you interested in helping spread the booklet download link across the world ?,0
Then why not simply copy this text ( & links ) and paste it into the description box of your YouTube videos ?,0
Thank you in advance. : ) Download the youtube `` description box '' info text file below @ http://www.mediafire.com/download/gxv2b33v37la6pz/Booklet % 20Description % 20Box % 20Info.txt,0
"I'm insulted by how stupid the Jews think we are until I see what they see by reading the posts amongst our so-called , `` Awakened Brethren . ''",1
I know what you mean .,0
"Sometimes I watch television here and the camera man asks some Americans where Canada is , most dont even know .",0
"A becsület napjás videó nagyon tuti , mindig amikor nézek felvételeket , vagy ismerőseim , barátaim mesélik , hihetetlen sajnálom , h a tanév pont úgy esik , h nem tudok ott lenni ...",2
"The video about the `` Day of honour '' , is really cool .",0
"Every time , when i watch these videos , or my friends , mates tells me about it , i always feel bad about , that i have to be here , becouse of the university ...",0
I heard whites could purchase land off each other if they wanted to move into Orania .,0
How much for a single white male to purchase a small plot ?,0
US dollars please .,0
I'm looking to study at a college in South Africa later in my life .,0
Are there any majority white universities in South Africa ?,0
"I 've seen University of Cape Town 's website and checked how many white students they have , about 40 % .",0
"What are the odds that flags will be ordered at half staff for this communist Negro terrorist , in the United States ?",0
nothing about white genocide is acceptable especially the fact that the mainstream media essentially denies it exist in the first place .,0
You have got it all wrong .,0
White nationalism is not about a bunch of nationalists who happen to be white .,0
It 's about the preservation and protection of the white race regardless of culture .,0
I had to start a new thread seeing as this thread was no longer functioning properly .,0
See the new thread @ https : //www.stormfront.org/forum/t989503/,0
The majority of the people in these photos are more of the threat to America than to the Ukraine in my opinion .,1
Ukraine defense minister ignores repeated phone calls from Chuck Hagel http://washingtonexaminer.com/ukrain ... rticle/2544358,0
I do n't know of to many whites that would want to live in non white homelands \ communities .,0
The non white homelands have so much trash and crime in them that non whites mainly choose to stay away .,1
PatrioticMama,0
"Absolutely, whenever i see a dirty white coon with dreadlocks i get the urge to grab him by his flea blanket head and head butt him senseless",1
the father said on the news this morning the church has already told him they would appel the verdict and if they lost again they would just file bankruptcy and he wouldnt see a dime !,0
"Sorry, but what they did was just sick and wrong .",0
Protesting at a funeral ?,0
That is just disgusting and completely immoral .,0
Seems like Jewtube has been down for a few hours .,0
When I try and go there I get a `` Bad Request '' HTML page .,0
Can anyone confirm if the Nuclear Plant has melted down or not ? ( I sincerely hope that it has not melted down or has been damaged in a dangerous radio active cloud spreading way. ),0
"The maker of this video originally thought it had melted down , but now feels it has not .",0
So I do n't know what to think ?,0
UPDATE 1pm CST !,0
Japan NUCLEAR REACTOR - RADIOACTIVE STEAM ON VIDEO - 3/11/11 YouTube - UPDATE 1pm CST !,0
Japan NUCLEAR REACTOR - RADIOACTIVE STEAM ON VIDEO - 3/11/11 UPDATE 1pm CST -- NOT GOOD !,0
Japan REACTOR - RODS MELT !,0
"CONFIRMED - March 12 , 2011 YouTube - UPDATE 1pm CST -- NOT GOOD !",0
Japan REACTOR - RODS MELT !,0
"CONFIRMED - March 12 , 2011 UPDATE 1pm CST - Meltdown , Outgassing !",0
NUCLEAR PLANT HAS FULLY EXPLODED !,0
"TAKE COVER YouTube - UPDATE 1pm CST - Meltdown , Outgassing !",0
NUCLEAR PLANT HAS FULLY EXPLODED !,0
TAKE COVER SOON JAPAN NUCLEAR EXPLOSION GLOBAL DISASTER FUKUSHIMA YouTube - JAPAN NUCLEAR EXPLOSION GLOBAL DISASTER FUKUSHIMA I received this image in an email this morning .,0
I have no idea if it is an accurate description of what could happen or not ?,0
"So , I do n't know what to say .",0
Let 's just hope this is n't worst case scenario .,0
Probably not .,0
White people tend to raise their own children .,0
"Except , of course , for those that pander to the filthy sons and daughters of Satan like ' ol Sandra here .",1
What a pathetic loser b ! tch ! : goof,0
When I saw this thread I was hoping she might actually go against the status quo and adopt a white baby So much for that theory !,0
What typical brainwashed liberal lemming .,1
Yawn,0
I went to high school with f * ckers just like the guy in the original video .,0
They talk and talk and talk but before they ever accomplish anything they always have one bad `` ni * * er moment '' and end up getting locked up .,0
I would n't worry too much at all .,0
The doctors of ju-ju and voodoo seem to have left their mud huts and moved into office buildings built by White people in cities built by White people .,1
Now there 's a medical advancement to think about .,0
"The story is available from the below link , which in turn came from AP .",0
http://www.whitewire.net/index.php ? p = 82#more-82 Who says that Dr. Pierce did n't accurately predict the future in the Turner Diaries ?,0
"I have just added Treblinka : By Carlo Mattogno , Extermination Camp or Transit Camp ?",0
I plan to add a few more books today as well,0
Mitt is that you ?,0
I live for the day that some genetic lottery winner is dumb enough to call me a peasant .,0
All I can do is hope and take care of my white family by working hard and makeing money so we can all be comfortable for Christmas .,0
I can go on forever talking about how to protect White Europe but everyone on stormfront knows my mentality already .,0
Pure .,0
We do need to stop judging each other and get o line for an hour and go do something `` positive '' in our area.Lets talk solution not petty diferences .,0
I think Whites should home school their children if at all possible .,0
The school systems are broken .,0
Even the best teachers have to play by THEIR rules so it does n't do much good for them to be there .,0
YouTube - Fight At Chuck E. Cheese In California !,0
"YouTube - Chucky cheese Brawl/Fight Yeah , never taking my kids there ... if and when I have kids",0
The guy in this is acting .,0
"Again , I appreciate the contributions to this thread , but videos like this have no value here .",0
More on Jamaica YouTube - Fighting rages in Jamaica Notice that this video was made by Al-Jazera Major Chimpout Warning !,0
Graphic YouTube - Video Jamaica Stay Wallin Rasta Man Chops Taxi Man With A Machette In Broad Daylight !,0
More negro savagery : YouTube - Detroit : 3 Black Males Murder pregnant white woman .,1
YouTube - Black kid sets teacher on fire .,0
YouTube - Detroit : Gang Battle at Funeral,0
"YouTube - White family beaten by mob of blacks YouTube - Black gang in Des Moines , Iowa chants `` It 's Beat Whitey Night '' as they assault white people YouTube - Black Man Punches Blind White Woman On Bus",0
Ive got nothing against it but i prefer one .,0
Never date outside your race Someone on this site has it on their posts,0
"The Legacy of Dr. William Pierce I know Hadding and Will Williams and others are working hard on this project to bring articles written by Dr. Pierce from the printed page to being put online , for all to read .",0
A noble effort .,0
"Front page of this weeks Folio Weekly ( free , and well-worth the price ) : Cover Story Running Like Crazy A new breed of fun runs with color , glow sticks and zombies leaves purists wondering what s next Jahshawn Marconi , Michelle Krueger , Carley Glasser , Britta Fortson , Madeline Fortson , Marisa Kenyon Zahariadis , Dillon Hawkins , Cody Burton , Sam Costanzo , Marci Gurnow , David Martinson and Sean Nagorny DENNIS HO",0
"Race-consciousness and the determination to preserve our own is part of our nature , being in essence a defining feature of the Aryan spirit .",0
Stupid White Man makes vacation get away in living room .,0
Intelligent Masculine Black Fed Ex Man comes to save the day and explain how stupid the white man is .,0
All the time the white wife is drooling over him and flirting with him .,0
Gatsby Coram & Stoney Westmoreland - FedEx Commercial `` Vacation at home '' - YouTube,0
Looking at things it was shown up till about a three thousand years ago no mongoloids existed in the Tairm basen area .,0
The whole area was Aryan .,0
I wonder what is under the Gobi ?,0
"Personally, I think this whites becoming the minority thing is being used by our enemies to discourage white voter turn out .",0
I wonder how much of this sort of behavior by Gates and his clique of social elites is because humans have an instinct to protect their position once they make `` top dog '' in a hierarchy .,0
These two elements in your comment are quite baffling .,0
How can you advocate for NS and simultaneously declare its CORE defining principle a `` blasphemy '' ?,0
"This is a sad reality it is sad to read some peoples stories makes me know how good I 've got it , and not to take things for granted .",0
"Well I could give you another word for the female version of that part of the anatomy it begins with a C ends with a T and has the letters UN in between , but the language filters wo n't let me",0
R.I.P my brothers and sisters for you are all heroes to me i need say no more cause actions speak louder than words .,0
"It's probably a combination of the sexual tastes of homosexuals ( toward the adolescent ) in the agency , and the racial agenda of liberals in the agency .",1
I go through this thread once a week to check the links .,0
"No matter how many times I browse through it , its impact does n't lessen .",0
Daniel Ramsey Shot and killed in his own house in front of his wife on Valentine 's Day by two negro burglars .,0
More info in the Ethnic Crime Report .,0
"This is the previous edition of that textbook `` Making Europe '' Amazon.com : Making Europe : People , Politics , and Culture since 1300 ( 9780618004829 ) : Frank L. Kidner , Maria Bucur , Ralph Mathisen , Sally McKee , Theodore R. Weeks : Books Amazon.com : Making Europe : People , Politics , and Culture since 1300 ( 9780618004829 ) : Frank L. Kidner , Maria Bucur , Ralph Mathisen , Sally McKee , Theodore R. Weeks : Books when you click on the picture to `` Look Inside '' the negro pops up .",0
She is Ukrainian .,0
See her in other pictures and you will see how she is a typical slavic .,0
Americans acting like they know what they 're talking about ..,0
Well actually young people can be converted with ease .,0
About half of Internet users are youth so it 's worth a try .,0
Angry sheboon trashes liquor store .,1
Over two thousand dollars damage and several hours to clean up .,0
"Female negro is `` sorry '' , owner pressing charges anyway. -- baltimoresun.com",0
Nothing too major here .,0
Just another sexual predator running loose .,0
Refusing to register as sex offender after molesting a 14 year old girl .,0
"Get the dogs out and track him down , I say !!!",0
EdgefieldDaily.com l Wanted Sex Offender,0
But i wanted to be friends with them too .,0
If only we had more friends that we could count on through thick and thin like balije .,0
Croats were so fortunate to have such reliable allies .,0
"Justin Butler , 28 , and Briana Adams , 21 ( coalburner ) , each face a criminal abuse charge after police say the couple 's infant child was found with six healing rib fractures and a broken femur http://www.lex18.com/news/couple-fac ... with-injuries/",0
"2-Year-Old Dies Of Rape , Mammy 's Boonfren ' Charged - NNN Reporters Newsroom Forum Dekalb 2-Year-Old Dead ; Caregiver Charged Police Say Child Was Abused POSTED : 10 : 41 pm EDT October 2 , 2010 UPDATED : 11 : 51 pm EDT October 3 , 2010 Dekalb 2-Year-Old Dead ; Caregiver Charged - DeKalb County Headlines News Story - WGCL Atlanta",0
The barbarians are at it again .,0
Leaves me to no surprise .,0
They will kill there own just as fast as they would kill there enemy .,1
"[quote=BoyHowdy;8475764] QUOTE ] Killed were Joshua Pennington , 27 , of East Earl Township ; Linda Lapp and her husband , Samuel , both 48 and residents of New Holland ; and Amy Wilhelm , 50 , and her husband Dennis `` Butch '' Wilhelm , 43 , of Manheim Township .",0
"Read more : Charges in deadly wreck that killed 5 motorcyclists - LancasterOnline.com News Crash takes injured woman 's fiancé , mom - LancasterOnline.com News",0
A teacher at a Baton Rouge elementary school was arrested just two hours into his first day on the job Tuesday .,0
"Damian Brown , 26 , was taken into custody by East Baton Rouge Parish sheriff 's deputies and charged with identity theft after officials at Scotlandville Elementary say he put three different social security numbers on his applications .",0
"http://www.wafb.com/Global/story.asp ? S = 11397795 Robinson had allegedly tried to sell the 225-pound piece of artillery , but Hurlee grew suspicious and called the Sheriff 's Office .",0
"Robinson ended up hawking the cannon to Top Paid Scrap , a salvage company in the 13000 block of Chef Menteur Highway in eastern New Orleans , according to a New Orleans police report filed in conjunction with Robinson 's arrest .",0
"http://www.nola.com/crime/index.ssf/...0/post_48.html Joy Lynn Aikens , 39 , was arrested Tuesday by Louisiana State Police .",0
She became a suspect when two people contacted the Department of Revenue claiming an agency employee requested credit card information when they called to make payments on their accounts .,0
http://www.wafb.com/Global/story.asp ? S = 11394504,0
I wish more mods saw it the way you did so that my friend Lycurgus might one day find himself unmoderated .,0
I doubt it though .,0
His style of posting is unique and unappreciated .,0
Swedish land perhaps ?,0
Jodr sounds much like Jord ( meaning Earth/land ) .,0
But on a humourous note it could also mean `` burnt earth '' ( svidd jord ) .,0
Wolf 278,0
Interesting article about what to do with these evil persons who keep telling the truth and who don ´ t want to surrender ( in Danish ),1
I would like to know how are the nationalists parties going on in the five countries of this beautiful part of Europe called Scandinavia ?,0
I allways stare at them first with very serious eyes and from long distance .,0
Then they show some shame in their face and turn away their eyes and do not disturb me with their staring .,0
2508,0
Lervik does not sound like a name on a person but is rather a name on place .,0
It means `` muddy bay '' .,0
"......according to DUP Northern Ireland minister , Nelson McCausland : Northern Ireland minister calls on Ulster Museum to promote creationism | Politics | The Guardian Hmm .",0
It was Stormfront been shown on TV3 that made m join the site .,0
So even if it was shown n a bad light I would hope it would bring lots more new members as the time has come to show the non white races that we can only take so much before we raise up,1
Heard about this a while back .,0
Was hoping it would be to commemorate the plantation as a dark part of our history but it appears to be celebrating it .,0
Sick,0
"Funny how they cant send someone to get pics of this so called Nazi gang attacking people in the city centre , sounds like more hype and nonsense .",0
"Im surprised C18 wasnt mentioned , they always are when the OB smash the EVIL neo = nazis Yellow press at its best",1
Yeah if I can get time off work for it .,0
I wonder if they 'll let me keep the extra euro if i say i 'm ' ' unwaged ' ' .,0
The fact that these people are trying to do the same thing to Ireland as they have in America and Britain and everywhere else they have set foot .,0
I do n't think anyone here is saying that the Polish are on the same level as blacks .,0
No white person should ever be compared to a black and other useless races .,1
correct.,0
I 'm studying here .,0
And I guess there 's nothing wrong in it .,0
THe thing i was asking if it is alright if i remain here afterwards ?,0
You may want to cut down on the milk too if you watch this .,0
YouTube - Milk The Deadly Poison WATCH THIS !!!,0
Meh..,0
I would prefer to get the lot of us together and tackle the real enemies of Northern Ireland and the Republic of Ireland ergo the Island of Ireland ... and the enemy is n't each other my brothers and sisters .,0
Mr A was correct again .,0
Not only did he not sell a car he ended up in court and 500euro lighter in the pocket from his latest meeting with a Negro .,0
Is that overweight fat useless bitch blind ?,1
What good are these scammers to the country who Broke EU law to come here ?,1
"This is precisely the frustration that brings any White person round to white nationalism , so obviously you are in exactly the right place .",0
I agree .,0
And that goes for Eastern Europeans and Asians as well .,0
All schools in Ireland should be segregated .,0
"If teachers have to focus extra attention on foreigners because they cannot speak English properly , it will be the indigenous Irish students who will suffer .",0
Check this video out SF ' we must welcome Africans with open arms they have every right to be in Ireland ' .,0
http://www.youtube.com/watch ? v = 0Ljpk ... elated & search =,0
Typical i suppose in the eyes of the law he is just another tourist beaten on sydneys streets oh yeah and we all know if it was a poor black fella bashed it would be on the news for weeks on end and mr whitey would be branded a big bad evil racist,1
did anyone go to this last night ?,0
I heard their was 5000 people at it .,0
Thats got to be a exaggeration right ?,0
I do n't think so .,0
Why is rugby dominated by whites ?,0
"Because white peoples build is more suited to rugby ( stronger upperbody , endurance etc ) .",0
Soccer is the black mans game as they are so many of them playing soccer in poportion to whites .,0
I 'm sure Gaelic games especially hurling would be too rough for them also .,0
I am looking for a website that will sell and deliver flags to Ireland .,0
"Anyone in Ireland who has got some flags please say where you got them , because I want some too .",0
35109,0
>>I would love to visist Ireland and eventually move there .,0
Your more than welcome if your predominantly Irish in ancestry .,0
2508,0
"Uh oh , looks like the mods are all away on summer vacation Are any of those anti-leftist comments by you guys ? living in America , this board is starting to give me hope !",0
All those evil irish ignorant racists 2508,0
Uh oh ... bad move there Mr. King .,0
I expect there will be half a dozen posters getting up on their soapboxes awful quickly ...,0
Aragorn,0
Well done to all the people in Ireland.Let 's hope this is just the start of people waking up to the dangers of a mulitracial society .,0
www.natall.com,0
"Yeah, Hell on earth .",0
I feel like I should pull out my passport when I want into walmart with all the * * * * ing pakis and * * * * in there,1
I finally heard back from the Child Development today .,0
My son will be scheduled to have his first assesment around September sometime .,0
It has only taken 14 months to arrive to this point .,0
Looks like some Jews good broken into their car and garage I just had to laugh when saw this .,1
Police investigating hate crime at Toronto home | CTV Toronto News,0
"nice to see another maritimer , the south shore is a beautiful place , i ride down that way a lot on my harley , i live in the annapolis valley .",0
"I'm in a Canadian city of about 30,000 .",0
Conservative and white .,0
"If there is a non white in town , everyone knows about it .",0
Has anyone been back to this zoo lately ?,0
"This used to be a nice white city , lots of German immigrants etc .",0
"Go to any major retail mall , the Kitchener farmers market , etc , and its absolutely teeming with non whites ( asians , blacks , hispanics , muslims of all colours , and God knows what else ) and race mixers , and yes I hate to say this but from what I saw the other day many more white women doing the race mixing than white men .",1
I am reminded of a quote I heard from a fellow white nationalist said that you do not clean up a pile of * * * * while being in the middle of it .,1
Sad but true .,0
"I just believe Kitchener , the once overwhelmingly white city has been ruined .",3
Meanwhile back in their ancestral homelands their races are and will always remain the overwhelming majority .,0
Double Standard ?,0
Also if they get fed up with multiculturalism they at least have a country they can go back to which is set up just for their race .,0
That's not even close to what he was doing .,0
"A more apt analogy would be if he went to a party and showed up to find a small group of whites standing around while darkies kept pouring through the door and acting like they owned the place , so he joined some of the whites in complaining about it .",0
I saw a white person in Scarborough once .,0
We stopped and looked at each other like `` WTF ??!,0
White person ! `` before hurrying to catch the TTC out of Scarborough .,0
Any NS government that has them views are dangerous to their own people because they would decide who is worthy and unworthy and would make them king maker to decide that .,0
"Never know , they could find you or me or anyone else undesirable in their eyes .",0
I would n't say I 'm looking at things too literally .,0
I see no reason to believe that the verse says anything other then it 's God doing those things .,0
"You may aswell start up a party called British Racist Party , the word fascist is deemed as bad if not worse .",0
"You cannot buy an identity , or even work your balls off for nothing for one .",0
These here parents need to go home and get one .,0
"http://exopolitics.blogs.com/files/eu-collective.pdf Have a read , this was wrote in the 70s .",0
In this text there is a table of how they are going to destroy our culture and implement their communist state .,0
"When I first saw this advertised it cracked me up , the fact that the white kid was made to look like an antagonist also just added to the laughs",0
"Six years old , our granddaughter came home from school today and announced `` I 'M A MUSLIM ! ''",0
Her dad is going to school with her tomorrow ....,0
It seems to mean anything that involves some place where the true white brit can meet and enjoy themselves is gradualy being shut or knocked down probably replace them with mosques .,0
i used to post on here a few years back as kruger but for some reason i cant register with that name so here goes with the new one 88 to all i know and to those i will meet,0
"A lurker from Down Under , a grandson of a royal marine green beret whom stormed Normandy and served in the pacific .",0
"Fight proud England , Fight",0
"They may be on to something Gay Men Will Marry Your Girlfriends - YouTube P.S. Please do n't bite my head off , this is mostly for entertainment purposes .",0
I'm going to say UKIP as they seem like at least a small step in the right direction but at the same time i 'm not sure what to make of all the theory 's that they are a distraction party and will just do the same as all the others when they get in ?,0
Scumbag swine Churchill .,0
He and Roosevelt deserve to die a thousand deaths .,0
"Let them , their families and anyone who knows or like them have their children burn in front of them and watch their flesh melt off of their bodies .",0
Just saying .,0
Manslaughter?,0
How about sticking the word hate on the police report and get the sentence quadrupled ?,0
I have to wonder exactly how far the indoctrination is going these days for such a hateful and sickening reaction to a free mind .,0
im with you here I see it day in day out like everyone else its easy to sit back and watch but together we are strong and its good to be with like minded people,0
